English,Mon,Original_Definition
Adj.  ၝောံ၊  မဒှ်ဗြဴဗြဴ၊  မဒှ်ၝောံၝောံ၊  မသယျာကောန်မာန်၊  မဆၚ်ကောန်မာန်၊  မခၟာဲမာန်၊  မဒှ်ဣတ္ထိလိၚ်။  ၂။  မဆေၚ်စပ်ကဵုဗြဴဗြဴတံ၊  မဆေၚ်စပ်ကဵုၝောံၝောံတံ။  female dancer.   ကဆိၚ်၊  သၟာကဆိၚ်၊  လဆိၚ်။  female devotee.   ရသိဗြဴ။  female disciple.   သာဝကဳ။  female friend.   ပြောဲ၊  ပြောဲဗြဴ။  female naga.   နာ်ဗြဴ၊  နာဂဵု။  female religious mendicant.   ဗဴမိန်၊  ဗြဴမိန်၊  သဳလ။,female,adj.  ၝောံ၊  မဒှ်ဗြဴဗြဴ၊  မဒှ်ၝောံၝောံ၊  မသယျာကောန်မာန်၊  မဆၚ်ကောန်မာန်၊  မခၟာဲမာန်၊  မဒှ်ဣတ္ထိလိၚ်။  ၂။  မဆေၚ်စပ်ကဵုဗြဴဗြဴတံ၊  မဆေၚ်စပ်ကဵုၝောံၝောံတံ။  female dancer. (adj)  ကဆိၚ်၊  သၟာကဆိၚ်၊  လဆိၚ်။  female devotee. (adj)  ရသိဗြဴ။  female disciple. (adj)  သာဝကဳ။  female friend. (adj)  ပြောဲ၊  ပြောဲဗြဴ။  female naga. (adj)  နာ်ဗြဴ၊  နာဂဵု။  female religious mendicant. (adj)  ဗဴမိန်၊  ဗြဴမိန်၊  သဳလ။
Adj. adv.  မဍာံစၟတ်၊  ဍာံဍာံ၊  နကဵုစိုတ်စရိုတ်ဇကုဍာံဍာံ၊  နကဵုစိုတ်စရိုတ်ဇကုဍာံဍာံယျဵုယျဵုလ္ဂူလ္ဂူ။,bona fide,adj. adv.  မဍာံစၟတ်၊  ဍာံဍာံ၊  နကဵုစိုတ်စရိုတ်ဇကုဍာံဍာံ၊  နကဵုစိုတ်စရိုတ်ဇကုဍာံဍာံယျဵုယျဵုလ္ဂူလ္ဂူ။
Adj. adv.  မဒှ်နကဵုပါၚ်တိုက်၊  နကဵုပါၚ်တိုက်။  a viva voce examination   ပေဲါသၟာန်လိက်နကဵုပါၚ်တိုက်။,viva voce,adj. adv.  မဒှ်နကဵုပါၚ်တိုက်၊  နကဵုပါၚ်တိုက်။  a viva voce examination (n)  ပေဲါသၟာန်လိက်နကဵုပါၚ်တိုက်။
Adj. adv.  မဒှ်လ္တူအိုတ်၊  သၠုၚ်အိုတ်။,uppermost,adj. adv.  မဒှ်လ္တူအိုတ်၊  သၠုၚ်အိုတ်။
Adj. adv.  မနွံအသၟဝ်တိ၊  အပ္ဍဲတိ၊  လ္ပာ်အသၟဝ်တိ။,underground,adj. adv.  မနွံအသၟဝ်တိ၊  အပ္ဍဲတိ၊  လ္ပာ်အသၟဝ်တိ။
Adj. adv.  မပှော်ဟဳတိတ်အာ၊  နဒဒှ်မပှော်ဟဳတိတ်အာ။,adrift,adj. adv.  မပှော်ဟဳတိတ်အာ၊  နဒဒှ်မပှော်ဟဳတိတ်အာ။
Adj. adv.  မသာတုဲသ္ၚောဲ၊  နဒဒှ်သာတုဲသ္ၚောဲ၊  သ္ၚောဲကွေံကွေံ။  ၂။  ပဲါနူဂှ်၊  ထပ်ပၠန်။  vt.  ကဵုအရီုအဗၚ်သွက်သ္ဂောံတောတက်ကၠုၚ်။  further shore.   မဒှ်အသြၚ်အဗၚ်ဒၞာဲဇမ္ၚောဲ။  adv.  သြၚ်လ္ပာ်တေံ။,further,adj. adv.  မသာတုဲသ္ၚောဲ၊  နဒဒှ်သာတုဲသ္ၚောဲ၊  သ္ၚောဲကွေံကွေံ။  ၂။  ပဲါနူဂှ်၊  ထပ်ပၠန်။  vt.  ကဵုအရီုအဗၚ်သွက်သ္ဂောံတောတက်ကၠုၚ်။  further shore. (adj)  မဒှ်အသြၚ်အဗၚ်ဒၞာဲဇမ္ၚောဲ။  adv.  သြၚ်လ္ပာ်တေံ။
Adj. adv.  လက်ဗၠိုက်၊  လက်ဗ္တက်။,upside-down,adj. adv.  လက်ဗၠိုက်၊  လက်ဗ္တက်။
Adj. bountiful   မဍိုက်ပေၚ်တဴကဵုဓဝ်တရးဂစာဲ၊  မလေပ်ကဵုဒါနတရးဂစာဲ။,bounteous,adj. bountiful (adj)  မဍိုက်ပေၚ်တဴကဵုဓဝ်တရးဂစာဲ၊  မလေပ်ကဵုဒါနတရးဂစာဲ။
Adj. cultured,ယေန်,"2 (n) adj. Cultured, gentle, charming, graceful, tame."
Adj. light headed,ရှောတ်,(n) adj. Light headed.
Adj. n.   နွံအောန်အိုတ်၊  နွံကဆံၚ်သဝ်အိုတ်၊  ဒဒှ်မနွံအောန်အိုတ်၊  ဒဒှ်မနွံကဆံၚ်သဝ်အိုတ်။,minimum,"adj. n. (pl.-ma,-s)  နွံအောန်အိုတ်၊  နွံကဆံၚ်သဝ်အိုတ်၊  ဒဒှ်မနွံအောန်အိုတ်၊  ဒဒှ်မနွံကဆံၚ်သဝ်အိုတ်။"
Adj. n.  စှ်ပန်။,fourteen,adj. n.  စှ်ပန်(၁၄)။
Adj. n.  စှ်ပိ ။  thirteenth   မဒှ်စှ်ပိလန်၊  တေရသမ။  n.  အရာမဒှ်စှ်ပိလန်၊  စှ်ပိစွံမွဲစွံ၊  စှ်ပိဂအုံမွဲဂအုံ။  thirty    ပိစှော် ။  thirtieth    မဒှ်ပိစှော်လန်၊  ပိစှော်ဂအုံမွဲဂအုံ။,thirteen,adj. n.  စှ်ပိ (၁၃)။  thirteenth (adj)  မဒှ်စှ်ပိလန်(ဝါ)၊  တေရသမ။  n.  အရာမဒှ်စှ်ပိလန်(ဝါ)၊  စှ်ပိစွံမွဲစွံ၊  စှ်ပိဂအုံမွဲဂအုံ။  thirty (adj) (n)  ပိစှော် (၃ဝ)။  thirtieth (adj) (n)  မဒှ်ပိစှော်လန်(ဝါ)၊  ပိစှော်ဂအုံမွဲဂအုံ။
Adj. n.  ပန် ။  four attachment.   ယောဂပန်၊  သံယောဇိုန်ပန်ပြကာ။  the four cardinal truths of buddhism.   သစ္စပန်။  the four elements.   ဓါန်ပန်။  four sided.   မနွံဒကဴပန်။  four-toothed porcupine.   ကဍော်၊  ခဍော်။,four,adj. n.  ပန် (၄)။  four attachment. (adj)  ယောဂပန်၊  သံယောဇိုန်ပန်ပြကာ။  the four cardinal truths of Buddhism. (n)  သစ္စပန်။  the four elements. (n)  ဓါန်ပန်။  four sided. (adj)  မနွံဒကဴပန်။  four-toothed porcupine. (n)  ကဍော်၊  ခဍော်။
Adj. n.  ပိ ၊  ကြိ၊  တြိ။  threefold   ပိဆ၊  မဒှ်ပိဆ။  the three gems of veneration of buddhists.   ရတ်ပိ။  three o'clock.   တက်ပိနာဍဳ၊  ပယာံတက်ပိ။  three times.   ပိအလန်၊  ပိလန်၊  ပိဝါ၊  ပိလတုန်။,three,"adj. n.  ပိ (၃)၊  ကြိ၊  တြိ။  threefold (adj)  ပိဆ၊  မဒှ်ပိဆ။  the three gems of veneration of Buddhists. (n)  ရတ်ပိ(ကျာ်,ဓဝ်,သၚ်)။  three o'clock. (n)  တက်ပိနာဍဳ၊  ပယာံတက်ပိ။  three times. (adj)  ပိအလန်၊  ပိလန်၊  ပိဝါ၊  ပိလတုန်။"
Adj. n.  မဆေၚ်စပ်ကဵုဂကူအမေရိကာန်၊  ဂကူအမေရိကာန်။  an american    ကောန်အမေရိကာန်။,American,adj. n.  မဆေၚ်စပ်ကဵုဂကူအမေရိကာန်၊  ဂကူအမေရိကာန်။  an American  (n)  ကောန်အမေရိကာန်။
Adj. n.  မဆေၚ်စပ်ကဵုဂိုဏ်ခရေတ် အိန်ဂလဳကိန်၊  ကောန်ဂကောံဂိုဏ်ဂှ်။,anglican,adj. n.  မဆေၚ်စပ်ကဵုဂိုဏ်ခရေတ် အိန်ဂလဳကိန်(အေန်ဂလိန်)၊  ကောန်ဂကောံဂိုဏ်ဂှ်။
Adj. n.  မဒှ်လၟိဟ်ပံၚ်လဝ်ဖအိုတ်၊  အပံၚ်၊  အပံၚ်ဖအိုတ်။  vt.  ပံၚ်လဝ်ဖအိုတ်၊  နွံလၟိဟ်ပံၚ်လဝ်သီုဖအိုတ်။  totally   သီုဖအိုတ်၊  အလုံဖအိုတ်။,total,adj. n.  မဒှ်လၟိဟ်ပံၚ်လဝ်ဖအိုတ်၊  အပံၚ်၊  အပံၚ်ဖအိုတ်။  vt.  ပံၚ်လဝ်ဖအိုတ်၊  နွံလၟိဟ်ပံၚ်လဝ်သီုဖအိုတ်။  totally (adv)  သီုဖအိုတ်၊  အလုံဖအိုတ်။
Adj. n.  မဒှ်အရံၚ်သာ်ဍီု၊  မဒှ်အရံၚ်တကး။,azure,adj. n.  မဒှ်အရံၚ်သာ်ဍီု၊  မဒှ်အရံၚ်တကး။
Adj. n.  မနွံကဵုအထောတ်မစိစောန်လဝ်နာနာသာ် စဵုကဵုမတ်ကြာန်ထုဲ။,baroque,adj. n.  မနွံကဵုအထောတ်မစိစောန်လဝ်နာနာသာ် စဵုကဵုမတ်ကြာန်ထုဲ(မတ်ဟပါ)။
Adj. n.  မဖျောန်လဝ်အရံၚ်သာ်ဗွဲမဂၠိုၚ်၊  မတက်လဝ်အရံၚ်ဗွဲမဂၠိုၚ်၊  မနွံကဵုအရံၚ်ဗွဲမဂၠိုၚ်၊  အရံၚ်ဗွဲမဂၠိုၚ်။,polychrome,adj. n.  မဖျောန်လဝ်အရံၚ်သာ်ဗွဲမဂၠိုၚ်၊  မတက်လဝ်အရံၚ်ဗွဲမဂၠိုၚ်၊  မနွံကဵုအရံၚ်ဗွဲမဂၠိုၚ်၊  အရံၚ်ဗွဲမဂၠိုၚ်။
Adj. n.  မွဲသၞာံၜါအလန်။  bias   ပွမဒစေၚ်ဗၠေၚ်အာမွဲလ္ပာ်၊  ပွမဗက်စမွဲလ္ပာ်။  ၂။  ကုတ်ကေတ်ဒစေၚ်ဒစေၚ်။  vt.  သကဵုဒစေၚ်ဗၠေၚ်အာမွဲလ္ပာ်၊  သကဵုဒစေၚ်ဝေက်အာ။,biannual,adj. n.  မွဲသၞာံၜါအလန်(ၜါဝါ)။  bias (n)  ပွမဒစေၚ်ဗၠေၚ်အာမွဲလ္ပာ်၊  ပွမဗက်စမွဲလ္ပာ်။  ၂။  ကုတ်ကေတ်ဒစေၚ်ဒစေၚ်။  vt.  သကဵုဒစေၚ်ဗၠေၚ်အာမွဲလ္ပာ်၊  သကဵုဒစေၚ်ဝေက်အာ။
Adj. n.  လ္ၚီ ။  thousandth   မဒှ်လ္ၚီလန်၊  လ္ၚီလန်။,thousand,adj. n.  လ္ၚီ (၁ဝဝဝ)။  thousandth (adj. n)  မဒှ်လ္ၚီလန်(ဝါ)၊  လ္ၚီလန်(ဝါ)။
Adj. pron.   ဏံ၊  ဝွံ၊  ဣဏံ၊  ဣၚုဟ်၊  ဣဝွံ။  this occasion.   လတုန်ဝါဝွံ။  this time.   လတုန်ဝွံ၊  ဝါဝွံ။  these days.   တ္ၚဲမစၞောန်ထ္ၜးလဝ်တံဂှ်၊  တ္ၚဲတံဂှ်။  take this.   ကေတ်ဣဂှ်။  this way and that.   ဒိုဟ်တေံဒိုဟ်ဝွံ။,this,adj. pron. (pl.these)  ဏံ၊  ဝွံ၊  ဣဏံ၊  ဣၚုဟ်၊  ဣဝွံ။  this occasion. (adj)  လတုန်ဝါဝွံ။  this time. (adj)  လတုန်ဝွံ၊  ဝါဝွံ။  these days. (adj)  တ္ၚဲမစၞောန်ထ္ၜးလဝ်တံဂှ်၊  တ္ၚဲတံဂှ်။  Take this. (pron)  ကေတ်ဣဂှ်။  this way and that. (adv)  ဒိုဟ်တေံဒိုဟ်ဝွံ။
Adj. pron.  တၞဟ်၊  သအာၚ်၊  တၞဟ်သအာၚ်၊  တၞဟ်သအာၚ်မွဲမွဲ၊  ညးတၞဟ်သအာၚ်မွဲမွဲ။  another world.   ပလိုက်၊  ပရလိုက်။  another thing.   မွဲတောၚ်။  from one to another.   နူမွဲကဵုမွဲ။,another,adj. pron.  တၞဟ်၊  သအာၚ်၊  တၞဟ်သအာၚ်၊  တၞဟ်သအာၚ်မွဲမွဲ၊  ညးတၞဟ်သအာၚ်မွဲမွဲ။  another world. (adj)  ပလိုက်၊  ပရလိုက်။  another thing. (adj)  မွဲတောၚ်။  from one to another. (pron)  နူမွဲကဵုမွဲ။
Adj. pron. adv.  မဒှ်ၜါ၊  မဒှ်ၜါဒိုဟ်။  ၂။  pron.  သီုၜါ၊  သီုညးၜါ၊  အိုဿီုညးၜါ။  adj.  မဒှ်မွဲဓဝ်ဟွံသေၚ်၊  မဒှ်သီုကဵု.....။  adv.  ဆဂှ်သၟးဟွံသေၚ်...သီုကဵု။,both,adj. pron. adv.  မဒှ်ၜါ၊  မဒှ်ၜါဒိုဟ်။  ၂။  pron.  သီုၜါ၊  သီုညးၜါ၊  အိုဿီုညးၜါ။  adj.  မဒှ်မွဲဓဝ်ဟွံသေၚ်၊  မဒှ်သီုကဵု.....။  adv.  ဆဂှ်သၟးဟွံသေၚ်...သီုကဵု။
Adj. မဍုတ်ဍေဲ၊  မလေပ်စိုတ်ဂၠေံ။,crabbed,adj. မဍုတ်ဍေဲ၊  မလေပ်စိုတ်ဂၠေံ။
Adjective,ပစ္စဲ,"(n) something which can be used for some purpose, accessories, parts, commodity, product, material, something one owns, property, goods. {gram} particle, word serving to qualify a noun, pronoun, adjective, verb or  an adverb. [id] ပစဲ(ယ်)။"
Adjective,ပစ္စယ်,"(n) something which can be used for some purpose, accessories, parts, commodity, product, material, something one owns, property, goods. {gram} particle, word serving to qualify a noun, pronoun, adjective, verb or  an adverb. [id] ပစဲ(ယ်)။"
Adjoin,ခဏေန်,"ထၞေန်စပ် (v) to adhere, adjoin."
Adjoin,ဍာပ်,"3 (v) to touch, adjoin, to dab on, sponge. [Cf.] first sense, စုက်၊ စပ်၊ စိပ်၊ ဒိ၊ ဒး၊ ဗ္စပ်၊ ဗဗာန်။ second sense, တၠေတ်၊ ပၠဳ၊ လံက်၊ လော်၊ လေတ်။    [Der.] ခ္ဍာပ် (v) to align together."
Adjoin,ထဏေန်,"ထၞေန်စေပ် (v) to adhere, adjoin."
Adjoin,ထၞေန်စပ်,"(v) to adhere, adjoin, be strongly attached to. [Syn.] စောန်စိုတ်။"
Adjoin,သၞေန်စပ်,"(v) to adhere, adjoin."
Adjoin.    ပ္ဍဲဍုၚ်သေံဂှ် ညးသိုၚ်ဇရာံစပ်မံၚ်သ္ၚိ  in saim,စပ်,"3 (v) to touch, be touching, to adjoin, adhere to, be joined, connected with.    စောဲစပ် (v) to have affection for, cleave to.    ဆေၚ်စပ် (v) to pertain to.    ထၞေန်စပ် (v) to adhere, adjoin.    ပ္ဍဲဍုၚ်သေံဂှ် ညးသိုၚ်ဇရာံစပ်မံၚ်သ္ၚိ (v) in Saim, they build granaries adjoining the house. [Cf.] ကြပ်၊ စုက်၊ စိပ်၊ ဍာပ်၊ ထၞေန်၊ ဒဗာန်၊ ဒိ၊ ဒး၊ ဒွံ(အ်)၊ ဗာန်၊ လုက်။    [Der.] ပစပ် (v) to touch, be touching.    ဖျပ် (v) to join."
Adjust a garment.  ရုၚ်သၠောံသ္ၚာ။,ရုၚ်သၠောံ,(v) adjust a garment. [id.] ရုၚ်သၠောံသ္ၚာ။
Adjust the flame of lamp,ဍေန်ပၟတ်,"(v) light, to light a lamp, adjust the flame of lamp."
Adjutant,ဗဵုဇၞော်ပရေၚ်ဒပ်,(n) adjutant.
Administer a remedy,သ္ကဵုဂဥုဲဇဗ,(v) administer a remedy.
Administer an oath of loyalty or fidelity,ကဵုသ္ပစၟတ်သစ္စ,(v) administer an oath of loyalty or fidelity.
Administer or receive medical treatment,လွဳယဲ,"(v) administer or receive medical treatment, give or tak medicinal treatment, care for a case of sickness."
Administrative chief of a hamlet or village,ကလန်,1 (n) administrative chief of a hamlet or village.
Administrative district .  ခဝါရး။,ခဝါ,1 (n) {Siam} administrative district {ampho}. [Cf.] ခဝါရး။
Administrative district.     to give.     during,တဝဵု,"1 (n) limit, boundary, area or period within limits, administrative district.    (v) to give.    (adv) during, always, continually. [id] တွဵု။ [Cf.] ပဝါ၊ ဗနဳ၊ ဗၞဳ၊ ရး။    တွဵုဂၠံၚ် (n) street of houses. [id] တွဵုဂၠောၚ်။    တွဵုပိတ္ၚဲ (n) for three day without stopping.    တွဵုရး (n) state, administrative division, district, township.    တွဵုရးတနၚ်သဳ (n) the Tenasserim Division.    တွဵုရးမုဟ်ဍုၚ် (n) Muhdung Township."
Administrative district.    ပွတွဵုတွေတ်  giving up liberality,တွဵု,"1 တွိုဝ် (n) limit, boundary, giving, dominion, area or period within limits, administrative district.    ပွတွဵုတွေတ် (n) giving up liberality."
Administrative district.    ပွတွဵုတွေတ်  giving up liberality,တွိုဝ်,"1 (n) limit, boundary, giving, dominion, area or period within limits, administrative district.    ပွတွဵုတွေတ် (n) giving up liberality."
Administrative district.  တွဵု။    တွဵုဂၠံၚ်  street of houses.    တွဵုပိတ္ၚဲ  for three days without stopping.    တွဵုရး  state,ကဝဵု,"1 (n) limit, boundary, area or period within limits, administrative district. [id] တွဵု။    တွဵုဂၠံၚ် (n) street of houses.    တွဵုပိတ္ၚဲ (n) for three days without stopping.    တွဵုရး (n) state, administrative division, district.    တွဵုရးတနၚ်သဳ (n) the Fenasserim Division [id] တွဵုရးတနၚ်္သဳ။    တွဵုရးမန် (n) Mon State. [id] ပွိုၚ်ဍုၚ်ဗၞဳရး။    တွဵုရးသေံ(မ်) (n) Shan State."
Administrative division,ကဝဵု,"1 (n) limit, boundary, area or period within limits, administrative district. [id] တွဵု။    တွဵုဂၠံၚ် (n) street of houses.    တွဵုပိတ္ၚဲ (n) for three days without stopping.    တွဵုရး (n) state, administrative division, district.    တွဵုရးတနၚ်သဳ (n) the Fenasserim Division [id] တွဵုရးတနၚ်္သဳ။    တွဵုရးမန် (n) Mon State. [id] ပွိုၚ်ဍုၚ်ဗၞဳရး။    တွဵုရးသေံ(မ်) (n) Shan State."
Administrative division,တဝဵု,"1 (n) limit, boundary, area or period within limits, administrative district.    (v) to give.    (adv) during, always, continually. [id] တွဵု။ [Cf.] ပဝါ၊ ဗနဳ၊ ဗၞဳ၊ ရး။    တွဵုဂၠံၚ် (n) street of houses. [id] တွဵုဂၠောၚ်။    တွဵုပိတ္ၚဲ (n) for three day without stopping.    တွဵုရး (n) state, administrative division, district, township.    တွဵုရးတနၚ်သဳ (n) the Tenasserim Division.    တွဵုရးမုဟ်ဍုၚ် (n) Muhdung Township."
Administrative division,တွဵုရး,"(n) administrative division, district, township, state, province."
Administrative unit,တွဵုဍုၚ်,"(n) division, administrative unit."
Administrative unit in a state,ခန်လွာနေဝ်,"(n) administrative unit in a state, field. [id] တိဍာ်။"
Admirably,နဒဒှ်မဒှ်ခိုဟ်အိုတ်,(adv) admirably.
Admiral,ဇမၞော်သ္ကိုပ်ဗဵု,"(n) general, admiral."
Admiration,အထိုၚ်အသး,"(n) admiration, acclamation. [id.] အထိုၚ်သး။"
Admiration,အသဝ်,"(n) [P. acchariyo] [Skt. ascarya] wonder, miracle, remarkable thing, amazement, admiration, marvel, astonishment."
Admission,တၚ်ဒုၚ်ဝန်,"(n) confession, admission, acknowledgement."
Admission fee,သြန်လုပ်ဂကောံ,(n) admission fee.
Admission fee,ၚုဟ်လုပ်ရုၚ်,(n) admission fee {to a theatre or cinema}.
Admit,ဒုၚ်ဝေါန်,"(v) ask permission, obtain consent, admit, confess, promise. [id] ဒုၚ်လဝ်ဝေါန်။"
Admit defeat,ဖျံတဲ,"(v) give up, stop trying, admit defeat."
Admit one's wrong,ဝေါန်စဝ်,"(n) to humble oneself, to render homage, admit one's wrong, apologize. [id.] ဝန်စဝ်။"
Admonition,ဩဝါဒ,"(n) [P.] admonition, exhortation, instructions. [id] ဂလာန်ကဵုသ္တိ၊ ဂလာန်ဒၠောံဗ္တောန်၊ တၚ်မစၞောန်ထ္ၜး၊ ဒၠောံဗ္စန်၊ ဗ္စန်ဂၞန်။"
Adog knie was going up to the monastery one day.  ရာ။,အရာ,"မွဲအရာပၠန်အဍံက်ခေဝ်တိုန်အာဘာမွဲတ္ၚဲ (n) one other thing, Adog Knie was going up to the monastery one day. [Var.] ရာ။"
Adolescent girl,ဝုတ်ပၠိုၚ်ပၠိုၚ်,"(n) fledgling, teenage girl, adolescent girl."
Adopt a humble attitude owing to humiliating circumstances,ဖျေံမုက်,"(v) bow one’s head to aver one’s eye from somebody, adopt a humble attitude owing to humiliating circumstances, dress {log or gem stone}."
Adopt new methods,ကေတ်ဒွန်တၟိ,(v) adopt new methods.
Adopted son,ကောန်လပှ်ဗ္စ,(n) adopted son.
Adorn .  စြံက်။,စရံက်,"(v) to put on, wear, adorn {as a ring or bracelet}. [id] စြံက်။"
Adorn.    စိစောန်ဖျေံဖျောန်မုက်မတ်  cosmetics for the face,စိစောန်,"2 (v) decorate, adorn.    စိစောန်ဖျေံဖျောန်မုက်မတ် (v) cosmetics for the face, make-up."
Adorn.    အေ ချေံဗှ်ေသွက်ဂွံကဝါ်ထပိုဲကယျိုၚ်လဝ်တုဲရဟာ  have you decked out your horse ready for the novice’s procession?    ကယျိုၚ်ကယျဝ်  to adorn with jewellery.       decoration,ကယျိုၚ်,"1 (v) to decorate, adorn.    အေ ချေံဗှ်ေသွက်ဂွံကဝါ်ထပိုဲကယျိုၚ်လဝ်တုဲရဟာ (v) have you decked out your horse ready for the novice’s procession?    ကယျိုၚ်ကယျဝ် (v) to adorn with jewellery.      (n) decoration, ornament.    ကယျိုၚ်ကျိုၚ် (v) be decked with. [id] ဖျေံကျိုၚ်။    ကယျိုၚ်လဝ်ဂၠံၚ် ကျေဝ်ဗွဲမလောန် (v) they decorated the streets very handsomely."
Adorned,လဟိုဟ်,"(v) to plaster, overlay, to be overlaid, decorate, adorned."
Adorned.  မြီညှာ၊ မြီသ္ဇုၚ်။  မြီသ္ဘဳ  to take care of,မြီဆာဲ,"(v) to be pretty, handsome, arrayed, adorned. [id.] မြီညှာ၊ မြီသ္ဇုၚ်။ [Der.] မြီသ္ဘဳ (v) to take care of, to attend."
Adornment.  ကပေါတ်ကယျိုၚ်ကယျဝ်၊ ဂ္ညိ။,ကပေါတ်ဂ္ညိဂ္ညာတ်,(n) adornment. [id] ကပေါတ်ကယျိုၚ်ကယျဝ်၊ ဂ္ညိ။
Adronyx,သၞေံတဲအုဲ,"(n) ingrown nail, adronyx."
Adult,ဇနော်,"1 (n) adult, senior person, chief, person in charge. [id] ဇၞော်။    ညးဇၞော်ကွာန် (n) senior men in village, village elders.    ပယျာံဇၞော်သၠိၚ် (n) time when adults go to sleep.    ဇၞော်ကွာန် (n) village head man.    ဇၞော်က္ၜၚ် (n) master of vessel.    ဇၞော်ဂုက် (n) gaoler. [id] ဇၞော်ထံၚ်။    ဇၞော်ဂြိုပ် (n) forest warden.    ဇၞော်ရုၚ် (n) station master. [Cf.] နာဲ၊ သ္ကိုပ်။    [Der.] ဇၞော် (v) to be great."
