English,Mon,Original_Definition
Adj.  ခေန်၊  မညဳတး၊  မတးလး၊  မတပ်တး၊  မကလိတ်ချဝ်၊  မပရေ၊  သ္တး၊  သ္တးသ္တေၚ်၊  သ္တးလး။  ၂။  မတုပ်သၟဟ်။  ၃။  မဒှ်ဂၞန်စုံ။  ၄။  မဒှ်ဗီုဓမ္မတာ၊  မညဳ၊  မညဳညတ်၊  မညဳသာ၊  မညဳသၟဟ်။  adv.  ပ္ဍဲအခိၚ်ဂှ်ရ၊  ကီုမ္ဂး၊  ဗွဲတွဵုမယုတ်၊  ၜိုန်.....ကီု၊  ၜိုန်ဂှ်ကီုလေဝ်၊  ၜိုတ်။  even with.   သၟဟ်ညဳ၊  သၟဟ်တး၊  သၟဟ်းသ္တး၊  သၟဟ်သၟန်။,even,adj.  ခေန်၊  မညဳတး၊  မတးလး၊  မတပ်တး၊  မကလိတ်ချဝ်၊  မပရေ၊  သ္တး၊  သ္တးသ္တေၚ်၊  သ္တးလး။  ၂။  မတုပ်သၟဟ်။  ၃။  မဒှ်ဂၞန်စုံ။  ၄။  မဒှ်ဗီုဓမ္မတာ၊  မညဳ၊  မညဳညတ်၊  မညဳသာ၊  မညဳသၟဟ်။  adv.  ပ္ဍဲအခိၚ်ဂှ်ရ၊  ကီုမ္ဂး၊  ဗွဲတွဵုမယုတ်၊  ၜိုန်.....ကီု၊  ၜိုန်ဂှ်ကီုလေဝ်၊  ၜိုတ်။  even with. (adj)  သၟဟ်ညဳ၊  သၟဟ်တး၊  သၟဟ်းသ္တး၊  သၟဟ်သၟန်။
Adj.  ခေံ၊  ချံၚ်၊  ခ္ဍဴ၊  ဂံက်၊  ဂံက်ကဍာဲ၊  မနွံကဵုဇိုၚ်ချံၚ်ချံၚ်၊  မနွံကဵုဇိုၚ်ဝေန်ဝေန်။  ၂။  မဒှ်သွက်ဂွံဒုၚ်တဲဝါတ်။  vt.  ဇိုၚ်ခေံ၊  ဇိုၚ်ချံၚ်၊  ဇိုၚ်ညႇံၚ်၊  ညႇံၚ်၊  ဝေန်၊  သကဵုဇိုၚ်ချံၚ်၊  သကဵုနွံကဆံၚ်သွက်ဂွံပတှ်ေစဝါတ်။  lamely   နဒဒှ်မနွံကဵုဇိုၚ်ချံၚ်ချံၚ်,lame,"adj.  ခေံ(ခေအ်)၊  ချံၚ်၊  ခ္ဍဴ၊  ဂံက်၊  ဂံက်ကဍာဲ၊  မနွံကဵုဇိုၚ်ချံၚ်ချံၚ်၊  မနွံကဵုဇိုၚ်ဝေန်ဝေန်။  ၂။  မဒှ်သွက်ဂွံဒုၚ်တဲဝါတ်။  vt.  ဇိုၚ်ခေံ၊  ဇိုၚ်ချံၚ်၊  ဇိုၚ်ညႇံၚ်၊  ညႇံၚ်၊  ဝေန်၊  သကဵုဇိုၚ်ချံၚ်၊  သကဵုနွံကဆံၚ်သွက်ဂွံပတှ်ေစဝါတ်။  lamely (adv)  နဒဒှ်မနွံကဵုဇိုၚ်ချံၚ်ချံၚ်,ဇိုၚ်ဝေန်ဝေန်၊  နဒဒှ်မဟၟဲကဵုယုတ္တိ။  lameness (n)  ဒဒှ်ဇိုၚ်မချံၚ်ဝေန်။"
Adj.  ချာ၊  ဆာ၊  ဍိုန်၊  ဖောဝ်။  မဖောဝ်လာဲ၊  မက္ၜတ်၊  မဂပေက်၊  မဍိုန်ဍောတ်၊  မလဇောတ်လမောဝ်။  ၂။  မဟွံသ္ကာတ်။  ၃။  မဇိပ်ကၠိပ်၊  မဇိပ်ဂၠိပ်၊  မဍိုက်ပေၚ်ကဵုဓဝ်ဂရုဏာ၊  မဍိုန်ညံ၊  မဍိုန်ၜတ်။  ၄။  မဍိုန်ဍောတ်ကလိတ်ကလောတ်။  ၅။  မသာက္ဍာ၊  သာသာ။  soften   ထဍိုန်၊  သကဵုဍိုန်ဍောတ်၊  သကဵုလဇောတ်လမောဝ်၊  သြောဝ်၊  သြောဝ်ဗလး။  softly   ဗွဲမဍိုန်ဍောတ်၊  ဗွဲမဇိပ်ဂၠိပ်။  softness   မုဒုတာ၊  ဒဒှ်မဍိုန်ဍောတ်လဇောတ်လမောဝ်။  soft-boiled rice.   ပုၚ်ခေါတောံ၊  ပုၚ်ခေါဒံ၊  ပုၚ်ၜိုတ်။  soft bread.   ကွာၚ်ထကဵု။,soft,adj.  ချာ၊  ဆာ၊  ဍိုန်၊  ဖောဝ်။  မဖောဝ်လာဲ၊  မက္ၜတ်၊  မဂပေက်၊  မဍိုန်ဍောတ်၊  မလဇောတ်လမောဝ်။  ၂။  မဟွံသ္ကာတ်။  ၃။  မဇိပ်ကၠိပ်၊  မဇိပ်ဂၠိပ်၊  မဍိုက်ပေၚ်ကဵုဓဝ်ဂရုဏာ၊  မဍိုန်ညံ၊  မဍိုန်ၜတ်။  ၄။  မဍိုန်ဍောတ်ကလိတ်ကလောတ်။  ၅။  မသာက္ဍာ၊  သာသာ။  soften (vt.vi)  ထဍိုန်၊  သကဵုဍိုန်ဍောတ်၊  သကဵုလဇောတ်လမောဝ်၊  သြောဝ်၊  သြောဝ်ဗလး။  softly (adv)  ဗွဲမဍိုန်ဍောတ်၊  ဗွဲမဇိပ်ဂၠိပ်။  softness (n)  မုဒုတာ၊  ဒဒှ်မဍိုန်ဍောတ်လဇောတ်လမောဝ်။  soft-boiled rice. (adj)  ပုၚ်ခေါတောံ၊  ပုၚ်ခေါဒံ၊  ပုၚ်ၜိုတ်။  soft bread. (adj)  ကွာၚ်ထကဵု။
Adj.  ချာ၊  ဍိုန်ဍောတ်။,plaint,adj.  ချာ၊  ဍိုန်ဍောတ်။
Adj.  ချံက်ချာ၊  မံဂြံ၊  သၞေံသၞဴ၊  မလေပ်ထ္ဍုတ်ဓမက်၊  မလေပ်ချံက်ချာ။,jocular,adj.  ချံက်ချာ၊  မံဂြံ၊  သၞေံသၞဴ၊  မလေပ်ထ္ဍုတ်ဓမက်၊  မလေပ်ချံက်ချာ။
Adj.  ခြာဟွံလံ၊  ဗဟူဏံ၊  မဒှ်ဒုတိယပၞောဝ်ကဵု မဓမံက်ထ္ၜးလဝ်ဗွဲလ္တူတေံ။  latterly   အပ္ဍဲအခါခေတ်ကာလဏံ၊  အပ္ဍဲအခါဗွဲဗဟူဏံ။,latter,adj.  ခြာဟွံလံ၊  ဗဟူဏံ၊  မဒှ်ဒုတိယပၞောဝ်ကဵု မဓမံက်ထ္ၜးလဝ်ဗွဲလ္တူတေံ။  latterly (adv)  အပ္ဍဲအခါခေတ်ကာလဏံ၊  အပ္ဍဲအခါဗွဲဗဟူဏံ။
Adj.  ခၞေက်၊  လတ်လတ်၊  မဟွံတောံလဝ်ဏီ၊  ဂျိုၚ်ဂျိုၚ်။  uncooked food.   ဇဟန်ဒမျိုၚ်။,uncooked,adj.  ခၞေက်၊  လတ်လတ်၊  မဟွံတောံလဝ်ဏီ၊  ဂျိုၚ်ဂျိုၚ်။  uncooked food. (adj)  ဇဟန်ဒမျိုၚ်။
Adj.  ခၠၚ်၊  မတဴမပြဲသၠုၚ်ပ္ဍဲကဆံၚ်၊  မက္ဍိုက်ပေၚ်တဴကဵုဂုန်စရာဲကျာ်သြဳ၊  သာၚ်ခဏ။,glorious,adj.  ခၠၚ်၊  မတဴမပြဲသၠုၚ်ပ္ဍဲကဆံၚ်၊  မက္ဍိုက်ပေၚ်တဴကဵုဂုန်စရာဲကျာ်သြဳ၊  သာၚ်ခဏ။
Adj.  ဂတ၊  နွံကဵုလၟေၚ်မဆက်စပ်ကၠုၚ်လ္ပာ်လက္ကရဴ၊  မသက္ကုသၟိၚ်။  n.  အရာမနွံစပ်ဒၟံၚ်လ္ပာ်လက္ကရဴ နအတိုၚ်လၟေၚ်။  ၂။  မဒှ်ကြပ်အိုတ်ယဝ်ရံၚ်ကေတ်ကဵုအခိၚ်ကာလ။  adv.  တုဲပၠန်ဂှ်၊  လက္ကရဴတေံပၠန်ဂှ်၊  မသက္ကုသၟိၚ်၊  တုဲပၠန်။  ၂။  ဒစှ်ေဂှ်၊  ပ္ဍဲဒၞာဲကြပ်အိုတ်၊  ဗွဲကြပ်ကြပ်၊  ပ္ဍဲသ္ကဲ၊  ဗွဲလ္ပာ်သ္ကဲ။  next morning.   ယးဂတ။  next world.   ပလိုက်၊  ပြလိုက်။  next year.   ယးသၞာံ။,next,adj.  ဂတ၊  နွံကဵုလၟေၚ်မဆက်စပ်ကၠုၚ်လ္ပာ်လက္ကရဴ၊  မသက္ကုသၟိၚ်။  n.  အရာမနွံစပ်ဒၟံၚ်လ္ပာ်လက္ကရဴ နအတိုၚ်လၟေၚ်။  ၂။  မဒှ်ကြပ်အိုတ်ယဝ်ရံၚ်ကေတ်ကဵုအခိၚ်ကာလ။  adv.  တုဲပၠန်ဂှ်၊  လက္ကရဴတေံပၠန်ဂှ်၊  မသက္ကုသၟိၚ်၊  တုဲပၠန်။  ၂။  ဒစှ်ေ(စိဟ်)ဂှ်၊  ပ္ဍဲဒၞာဲကြပ်အိုတ်၊  ဗွဲကြပ်ကြပ်၊  ပ္ဍဲသ္ကဲ၊  ဗွဲလ္ပာ်သ္ကဲ။  next morning. (adj)  ယးဂတ။  next world. (adj)  ပလိုက်၊  ပြလိုက်။  next year. (adj)  ယးသၞာံ။
Adj.  ဂမ္တၚ်၊  မဂမ္တၚ်၊  မနွံကဵုရှ်ဂမ္တၚ်။  ၂။  မဂိဓဇောတ်၊  မဒုၚ်ဒဝ်ဝါတ်၊  မဇၞော်ကဵုဒေါသ၊  မလေပ်တ္ၚံက်ဍုတ်ဍေဲ။  bitterly   နဒဒှ်မဂမ္တၚ်္ၚာပ်၊  ဗွဲမဂမ္တၚ်။  bitterness   မဂမ္တၚ်၊  ဂမ္တၚ်။,bitter,adj.  ဂမ္တၚ်၊  မဂမ္တၚ်၊  မနွံကဵုရှ်ဂမ္တၚ်။  ၂။  မဂိဓဇောတ်၊  မဒုၚ်ဒဝ်ဝါတ်၊  မဇၞော်ကဵုဒေါသ၊  မလေပ်တ္ၚံက်ဍုတ်ဍေဲ။  bitterly (adv)  နဒဒှ်မဂမ္တၚ်္ၚာပ်၊  ဗွဲမဂမ္တၚ်။  bitterness (adj)  မဂမ္တၚ်၊  ဂမ္တၚ်။
Adj.  ဂမ္ဘဳရ၊  မဇိပ်ကၠိပ်၊  မဇြိုဟ်နက်၊  မဇြိုဟ်နက်ပ္ဍဲအဓိပ္ပါယ်၊  မဝါတ်ဂါတ်၊  သၠောဟ်ကၠောဟ်။,abstruse,adj.  ဂမ္ဘဳရ၊  မဇိပ်ကၠိပ်၊  မဇြိုဟ်နက်၊  မဇြိုဟ်နက်ပ္ဍဲအဓိပ္ပါယ်၊  မဝါတ်ဂါတ်၊  သၠောဟ်ကၠောဟ်။
Adj.  ဂမျိုၚ်၊  မနွံကဵုလမျီု၊  မဂျိုၚ်ဒၟံၚ်ကဵုလမျီု။  adj.  ယီုလုပ်၊  ယီုတိတ်။  n.  ပွမဂယိုၚ်လမျီု၊  ဂမျိုၚ်လမျီု။  living being.   သတ်မနွံကဵုလမျီု။  living with.   မံၚ်မွဲစွံ။,living,adj.  ဂမျိုၚ်၊  မနွံကဵုလမျီု၊  မဂျိုၚ်ဒၟံၚ်ကဵုလမျီု။  adj.  ယီုလုပ်၊  ယီုတိတ်။  n.  ပွမဂယိုၚ်လမျီု၊  ဂမျိုၚ်လမျီု။  living being. (adj)  သတ်မနွံကဵုလမျီု။  living with. (vi.part.)  မံၚ်မွဲစွံ။
Adj.  ဂမြ၊  သာတုဲအောန်။  n.  လၟိဟ်သာတုဲအောန်၊  အခိၚ်အောန်အောန်။  lessen   တရဳ၊  တရဳကၠေံ၊  ဖအောန်၊  သကဵုအောန်အာ၊  သကဵုသာတုဲအောန်အာ။  lesser   မဒှ်သာတုဲသဝ်စှ်ေ၊  မဒှ်သာတုဲပရေံ။  lesser duties.   အဘိသမာစာရိကဝတ်။  less than.   ယုတ်ဒေက်အာ။,less,adj.  ဂမြ၊  သာတုဲအောန်။  n.  လၟိဟ်သာတုဲအောန်၊  အခိၚ်အောန်အောန်။  lessen (vt.vi)  တရဳ၊  တရဳကၠေံ၊  ဖအောန်၊  သကဵုအောန်အာ၊  သကဵုသာတုဲအောန်အာ။  lesser (adj)  မဒှ်သာတုဲသဝ်စှ်ေ၊  မဒှ်သာတုဲပရေံ။  lesser duties. (adj)  အဘိသမာစာရိကဝတ်။  less than. (adv)  ယုတ်ဒေက်အာ။
Adj.  ဂမြၚ်၊  မတၞီဗၠိုက်ဒၟံၚ်ပ္ဍဲအရာဒုၚ်စသိုၚ်စိုတ်အရီု။  rapture   ဒဒှ်မလဟိၚ်မိပ်ဒၟံၚ်ပ္ဍဲစိုတ်။  rapturous   မလဟိၚ်မိပ်ဒၟံၚ်ပ္ဍဲစိုတ်။,rapt,adj.  ဂမြၚ်၊  မတၞီဗၠိုက်ဒၟံၚ်ပ္ဍဲအရာဒုၚ်စသိုၚ်စိုတ်အရီု။  rapture (n)  ဒဒှ်မလဟိၚ်မိပ်ဒၟံၚ်ပ္ဍဲစိုတ်။  rapturous (adj)  မလဟိၚ်မိပ်ဒၟံၚ်ပ္ဍဲစိုတ်။
Adj.  ဂရာၚ်၊  ဂရာၚ်ဂရံ၊  မနွံကဆံၚ်ဖျေံစိုတ်ဟွံဂွံ။,cranky,adj.  ဂရာၚ်၊  ဂရာၚ်ဂရံ၊  မနွံကဆံၚ်ဖျေံစိုတ်ဟွံဂွံ။
Adj.  ဂလဵု၊  ဂလဵုခဏံၚ်၊  ထဏံၚ်၊  ထၞံၚ်၊  ဓလဵု၊  ဓလဵုထနံၚ်၊  မ္ၚိုဟ်စ္ဍိုဟ်၊  မ္ၚိုဟ်ထ္ဍိုဟ်၊  မဟီုဂးစဝါတ်၊  မကြံၚ်မ္ၚိုဟ်က္ဍိုပ်၊  မတေၚ်မ္ၚိုဟ်။  stubbornness   စရံၚ်။,stubborn,adj.  ဂလဵု၊  ဂလဵုခဏံၚ်၊  ထဏံၚ်၊  ထၞံၚ်၊  ဓလဵု၊  ဓလဵုထနံၚ်၊  မ္ၚိုဟ်စ္ဍိုဟ်၊  မ္ၚိုဟ်ထ္ဍိုဟ်၊  မဟီုဂးစဝါတ်၊  မကြံၚ်မ္ၚိုဟ်က္ဍိုပ်၊  မတေၚ်မ္ၚိုဟ်။  stubbornness (n)  စရံၚ်(ကြံၚ်)။
Adj.  ဂလဵု၊  ဂလဵုခၞံၚ်၊  မဒှ်ကဆံၚ်သွက်ဂွံထိၚ်ဒက်ဝါတ်။,intractable,adj.  ဂလဵု၊  ဂလဵုခၞံၚ်၊  မဒှ်ကဆံၚ်သွက်ဂွံထိၚ်ဒက်ဝါတ်။
Adj.  ဂီု၊  မက္တဴဂီု၊  မအုပ်ဇြုၚ်၊  မသကဵုနွံက္တဴက္တဴဂီုဂီု၊  မသ္ဍိုက်မၠိုက်ဆာန်ဍူ၊  မနွံကဵုကဆံၚ်လိုက်လိုက်လဴလဴ၊  မနွံကဵုကဆံၚ်မိပ်မိပ်မြဟ်မြဟ်၊  မနွံကဵုဆာန်ဆာန်သၟိန်သၟိန်။  vt.vi.  ဂတဴ၊  သကဵုက္တဴဂီုကၠုၚ်၊  သကဵုဓာတ်စိုတ်တိုန်ကၠုၚ်၊  သကဵုပါကၠုၚ်သီုစိုတ်သီုစရိုတ်။  n.  ပြဝမသကဵုက္တဴဂီု။  warmly   လိုက်လိုက်လဴလဴ။  warm oneself at a fire.   ၜံၚ်ပၟတ်။  warm water.   ဍာ်ဂမ္တဴ။  warmblooded   မဒှ်ဂကူ မနွံကဵုဆီက္တဴဂီု၊  မနွံကဵုစိုတ်ချဳဒရာၚ်လောဲ။  warmhearted   မလေပ်ဆာန်ဍူ၊  မလေပ်ချပ်ပတဝ်ကဵုစိုတ်ဇကုဇကု။  warmth   အကာဲအရာမဂမ္တဴဂီု၊  ပြဝစိုတ်မချဳဒရာၚ်၊  ပြဝမနွံကဵုသီုစိုတ်သီုမာန်။,warm,adj.  ဂီု၊  မက္တဴဂီု၊  မအုပ်ဇြုၚ်၊  မသကဵုနွံက္တဴက္တဴဂီုဂီု၊  မသ္ဍိုက်မၠိုက်ဆာန်ဍူ၊  မနွံကဵုကဆံၚ်လိုက်လိုက်လဴလဴ၊  မနွံကဵုကဆံၚ်မိပ်မိပ်မြဟ်မြဟ်၊  မနွံကဵုဆာန်ဆာန်သၟိန်သၟိန်။  vt.vi.  ဂတဴ၊  သကဵုက္တဴဂီုကၠုၚ်၊  သကဵုဓာတ်စိုတ်တိုန်ကၠုၚ်၊  သကဵုပါကၠုၚ်သီုစိုတ်သီုစရိုတ်။  n.  ပြဝမသကဵုက္တဴဂီု။  warmly (adv)  လိုက်လိုက်လဴလဴ။  warm oneself at a fire. (vt)  ၜံၚ်ပၟတ်(ကၟတ်)။  warm water. (adj)  ဍာ်ဂမ္တဴ။  warmblooded (adj)  မဒှ်ဂကူ(သတ်) မနွံကဵုဆီက္တဴဂီု၊  မနွံကဵုစိုတ်ချဳဒရာၚ်လောဲ။  warmhearted (adj)  မလေပ်ဆာန်ဍူ၊  မလေပ်ချပ်ပတဝ်ကဵုစိုတ်ဇကုဇကု။  warmth (n)  အကာဲအရာမဂမ္တဴဂီု၊  ပြဝစိုတ်မချဳဒရာၚ်၊  ပြဝမနွံကဵုသီုစိုတ်သီုမာန်။
Adj.  ဂေါဝ်၊  ဂေါဝ်ဆာဲ၊  ဂေါဝ်ဂါ၊  ဂေါဝ်ဂပ်၊  ဂေါဝ်ဇြုၚ်၊  ဂေါဝ်မြီ၊  တ္ၜတ်သြဴ၊  ဗဂေါဝ်၊  မြီ၊  မြီဆာဲ၊  မြီညှ၊  မြီသ္ဇုၚ်၊  ရံၚ်စခိုဟ်၊  ဒးရး၊  ကျေဝ်လှေံ၊  ကလိတ်ကလောတ်၊  ဝါမ၊  ၜတ်သဴ၊  ၜတ်သောၚ်။  ၂။  မနွံကဵုသဒ္ဓာစိုတ်ပါ်ပါ်။,handsome,adj.  ဂေါဝ်၊  ဂေါဝ်ဆာဲ၊  ဂေါဝ်ဂါ၊  ဂေါဝ်ဂပ်၊  ဂေါဝ်ဇြုၚ်၊  ဂေါဝ်မြီ၊  တ္ၜတ်သြဴ၊  ဗဂေါဝ်၊  မြီ၊  မြီဆာဲ၊  မြီညှ၊  မြီသ္ဇုၚ်၊  ရံၚ်စခိုဟ်၊  ဒးရး၊  ကျေဝ်လှေံ၊  ကလိတ်ကလောတ်၊  ဝါမ၊  ၜတ်သဴ၊  ၜတ်သောၚ်။  ၂။  မနွံကဵုသဒ္ဓာစိုတ်ပါ်ပါ်။
Adj.  ဂြၚ်ဂုန်၊  မတီဂုဏ်၊  တ္ၜိုပ်မိပ်၊  မဂြၚ်ဂုန်၊  မတၚ်ဂုန်ဂၞာတ်။,grateful,adj.  ဂြၚ်ဂုန်၊  မတီဂုဏ်၊  တ္ၜိုပ်မိပ်၊  မဂြၚ်ဂုန်၊  မတၚ်ဂုန်ဂၞာတ်။
Adj.  ဂွ၊  ဂွရောံဓည။,bashful,adj.  ဂွ၊  ဂွရောံဓည။
Adj.  ဂွ၊  မဂွ၊  မဖေက်ဂွ၊  မဂွံမုက်ဂဝ၊  မကရောဲဂဝ။,ashamed,adj.  ဂွ၊  မဂွ၊  မဖေက်ဂွ၊  မဂွံမုက်ဂဝ၊  မကရောဲဂဝ။
Adj.  ဂၞဴချုက်၊  ဒၞဴဗိုန်၊  မနွံကဆံၚ်ဂၞဴဗိုန်။,csotive,adj.  ဂၞဴချုက်၊  ဒၞဴဗိုန်၊  မနွံကဆံၚ်ဂၞဴဗိုန်။
Adj.  ဂၠဝ်၊  မလ္ၚာဒၟံၚ်။  ၂။  မချဳလရုတိုန်ဟွံမွဲ၊  မလဇုဲလဇဇြိုၚ်ဇြုဲ,supine,adj.  ဂၠဝ်၊  မလ္ၚာဒၟံၚ်။  ၂။  မချဳလရုတိုန်ဟွံမွဲ၊  မလဇုဲလဇဇြိုၚ်ဇြုဲ.
Adj.  ဂၠဟ်။  n.  လ္ပာ်သ္ကဲပုၚ်က္ၜၚ်။,starboard,adj.  ဂၠဟ်။  n.  လ္ပာ်သ္ကဲပုၚ်က္ၜၚ်။
Adj.  ဂၠိုၚ်ဗွဲ၊  ဒှ်ယိုဟ်။  profusely   နဒဒှ်မဂၠိုၚ်တဴဗွဲ။  profusion   ဒဒှ်မဂၠိုၚ်ဂၠေၚ်။,profuse,adj.  ဂၠိုၚ်ဗွဲ၊  ဒှ်ယိုဟ်။  profusely (adv)  နဒဒှ်မဂၠိုၚ်တဴဗွဲ။  profusion (n)  ဒဒှ်မဂၠိုၚ်ဂၠေၚ်။
Adj.  ဂၠိ၊  ဗိုန်ဂၠိ၊  မပဆုဲဏာနၚ်ဟွံဂွံ ဟွံမာန်။,immovable,adj.  ဂၠိ၊  ဗိုန်ဂၠိ၊  မပဆုဲဏာနၚ်ဟွံဂွံ ဟွံမာန်။
Adj.  စတုတ္ထ၊  ပန်လန်၊  ပန်ဝါ။  n.  လၟိဟ်၊  လၟိဟ်ဂၞန်။  fourth lunar month of the mon.   ဒ္ဂိုန်၊  ဂိတုဒ္ဂိုန်။,fourth,adj.  စတုတ္ထ၊  ပန်လန်၊  ပန်ဝါ။  n.  လၟိဟ်၊  လၟိဟ်ဂၞန်။  fourth lunar month of the Mon. (adj)  ဒ္ဂိုန်၊  ဂိတုဒ္ဂိုန်။
Adj.  စမးစမး၊  ဒဒှ်မနွံဇကုသၟး၊  မဟၟဲကဵုဗွိုက်လ္တက်၊  မဗလးလဝ်ဇကုဗလာ၊  မဒှ်မုဟွံမွဲ၊  မသၠောတ်လဝ်ဖအိုတ်။  nakedly   နဒဒှ်မဟၟဲကဵုဗွိုက်လ္တက်။  nakedness   ဒဒှ်မဟၟဲကဵုဗွိုက်လ္တက်။,naked,adj.  စမးစမး၊  ဒဒှ်မနွံဇကုသၟး၊  မဟၟဲကဵုဗွိုက်လ္တက်၊  မဗလးလဝ်ဇကုဗလာ၊  မဒှ်မုဟွံမွဲ၊  မသၠောတ်လဝ်ဖအိုတ်။  nakedly (adv)  နဒဒှ်မဟၟဲကဵုဗွိုက်လ္တက်။  nakedness (n)  ဒဒှ်မဟၟဲကဵုဗွိုက်လ္တက်။
